{
  "race_id": 1179,
  "season": 2026,
  "round": 11,
  "snapshot": "post_qualifying",
  "generated_at": "2026-07-25T17:00:00Z",
  "model_version": "mock-v0",
  "data_version": "v0.1.1-data",
  "commit_sha": "0000000",
  "is_mock": true,
  "drivers": [
    {
      "driverId": 846,
      "team_entity_id": "1-1968",
      "p_win": 0.198025,
      "p_podium": 0.531325,
      "p_top10": 0.987625,
      "p_dnf": 0.084728,
      "expected_position": 3.79775,
      "position_distribution": [
        0.198025,
        0.176975,
        0.156325,
        0.133575,
        0.1051,
        0.080375,
        0.059225,
        0.039225,
        0.02465,
        0.01415,
        0.007825,
        0.002975,
        0.001025,
        0.0004,
        0.000075,
        0.000075,
        0,
        0,
        0,
        0,
        0,
        0
      ],
      "top_factors": [
        {
          "label": "Qualifying position",
          "direction": "positive",
          "magnitude": 0.492991
        },
        {
          "label": "Gap to pole",
          "direction": "negative",
          "magnitude": 0.355211
        },
        {
          "label": "Long-run practice pace",
          "direction": "positive",
          "magnitude": 0.437713
        }
      ]
    },
    {
      "driverId": 830,
      "team_entity_id": "9-2005",
      "p_win": 0.1958,
      "p_podium": 0.524925,
      "p_top10": 0.9867,
      "p_dnf": 0.140235,
      "expected_position": 3.846925,
      "position_distribution": [
        0.1958,
        0.17495,
        0.154175,
        0.131675,
        0.1061,
        0.08115,
        0.059,
        0.042725,
        0.0258,
        0.015325,
        0.0076,
        0.003875,
        0.00135,
        0.000425,
        0.00005,
        0,
        0,
        0,
        0,
        0,
        0,
        0
      ],
      "top_factors": [
        {
          "label": "Team form, last 5 races",
          "direction": "positive",
          "magnitude": 0.257369
        },
        {
          "label": "Circuit history",
          "direction": "positive",
          "magnitude": 0.505725
        },
        {
          "label": "Grid penalty",
          "direction": "negative",
          "magnitude": 0.704214
        }
      ]
    },
    {
      "driverId": 847,
      "team_entity_id": "131-2010",
      "p_win": 0.14965,
      "p_podium": 0.42985,
      "p_top10": 0.969825,
      "p_dnf": 0.040017,
      "expected_position": 4.498825,
      "position_distribution": [
        0.14965,
        0.142975,
        0.137225,
        0.12835,
        0.111075,
        0.0956,
        0.07855,
        0.059975,
        0.0406,
        0.025825,
        0.0159,
        0.007825,
        0.004075,
        0.0017,
        0.0005,
        0.000175,
        0,
        0,
        0,
        0,
        0,
        0
      ],
      "top_factors": [
        {
          "label": "Teammate qualifying gap",
          "direction": "negative",
          "magnitude": 0.461015
        },
        {
          "label": "Overtaking difficulty here",
          "direction": "negative",
          "magnitude": 0.894615
        },
        {
          "label": "Qualifying position",
          "direction": "positive",
          "magnitude": 0.603961
        }
      ]
    },
    {
      "driverId": 844,
      "team_entity_id": "6-1950",
      "p_win": 0.081975,
      "p_podium": 0.257375,
      "p_top10": 0.8774,
      "p_dnf": 0.162571,
      "expected_position": 6.218025,
      "position_distribution": [
        0.081975,
        0.084125,
        0.091275,
        0.09625,
        0.09845,
        0.100275,
        0.0971,
        0.08675,
        0.0802,
        0.061,
        0.045825,
        0.031225,
        0.022325,
        0.013025,
        0.0066,
        0.00235,
        0.000925,
        0.000275,
        0.00005,
        0,
        0,
        0
      ],
      "top_factors": [
        {
          "label": "Gap to pole",
          "direction": "negative",
          "magnitude": 0.52449
        },
        {
          "label": "Long-run practice pace",
          "direction": "positive",
          "magnitude": 0.861249
        },
        {
          "label": "Team form, last 5 races",
          "direction": "positive",
          "magnitude": 0.630428
        }
      ]
    },
    {
      "driverId": 1,
      "team_entity_id": "6-1950",
      "p_win": 0.0709,
      "p_podium": 0.2329,
      "p_top10": 0.84915,
      "p_dnf": 0.110268,
      "expected_position": 6.5537,
      "position_distribution": [
        0.0709,
        0.0794,
        0.0826,
        0.088175,
        0.097775,
        0.096275,
        0.096325,
        0.091,
        0.079625,
        0.067075,
        0.0542,
        0.0394,
        0.0274,
        0.015025,
        0.008375,
        0.0043,
        0.0015,
        0.0005,
        0.00015,
        0,
        0,
        0
      ],
      "top_factors": [
        {
          "label": "Circuit history",
          "direction": "positive",
          "magnitude": 0.739686
        },
        {
          "label": "Grid penalty",
          "direction": "negative",
          "magnitude": 0.386027
        },
        {
          "label": "Teammate qualifying gap",
          "direction": "negative",
          "magnitude": 0.597625
        }
      ]
    },
    {
      "driverId": 859,
      "team_entity_id": "215-2024",
      "p_win": 0.06665,
      "p_podium": 0.211,
      "p_top10": 0.815225,
      "p_dnf": 0.148286,
      "expected_position": 6.95835,
      "position_distribution": [
        0.06665,
        0.069625,
        0.074725,
        0.080225,
        0.087425,
        0.089925,
        0.0929,
        0.091925,
        0.08725,
        0.074575,
        0.06115,
        0.045475,
        0.034775,
        0.021675,
        0.011925,
        0.0062,
        0.002675,
        0.000575,
        0.000275,
        0.00005,
        0,
        0
      ],
      "top_factors": [
        {
          "label": "Overtaking difficulty here",
          "direction": "negative",
          "magnitude": 0.669221
        },
        {
          "label": "Qualifying position",
          "direction": "positive",
          "magnitude": 0.388245
        },
        {
          "label": "Gap to pole",
          "direction": "negative",
          "magnitude": 0.899735
        }
      ]
    },
    {
      "driverId": 863,
      "team_entity_id": "131-2010",
      "p_win": 0.0466,
      "p_podium": 0.153075,
      "p_top10": 0.7005,
      "p_dnf": 0.111619,
      "expected_position": 8.1464,
      "position_distribution": [
        0.0466,
        0.0513,
        0.055175,
        0.061,
        0.070375,
        0.07545,
        0.081425,
        0.086025,
        0.088275,
        0.084875,
        0.078275,
        0.067625,
        0.05445,
        0.040225,
        0.027475,
        0.017025,
        0.009,
        0.003275,
        0.00145,
        0.000575,
        0.0001,
        0.000025
      ],
      "top_factors": [
        {
          "label": "Long-run practice pace",
          "direction": "positive",
          "magnitude": 0.849662
        },
        {
          "label": "Team form, last 5 races",
          "direction": "positive",
          "magnitude": 0.881165
        },
        {
          "label": "Circuit history",
          "direction": "positive",
          "magnitude": 0.38651
        }
      ]
    },
    {
      "driverId": 807,
      "team_entity_id": "216-2026",
      "p_win": 0.044975,
      "p_podium": 0.151,
      "p_top10": 0.6936,
      "p_dnf": 0.139714,
      "expected_position": 8.2221,
      "position_distribution": [
        0.044975,
        0.050875,
        0.05515,
        0.058525,
        0.067325,
        0.074175,
        0.0811,
        0.084425,
        0.0888,
        0.08825,
        0.078625,
        0.071275,
        0.055575,
        0.04235,
        0.027225,
        0.015925,
        0.009225,
        0.0045,
        0.001275,
        0.00035,
        0.000075,
        0
      ],
      "top_factors": [
        {
          "label": "Grid penalty",
          "direction": "negative",
          "magnitude": 0.373997
        },
        {
          "label": "Teammate qualifying gap",
          "direction": "negative",
          "magnitude": 0.480207
        },
        {
          "label": "Overtaking difficulty here",
          "direction": "negative",
          "magnitude": 0.325883
        }
      ]
    },
    {
      "driverId": 866,
      "team_entity_id": "9-2005",
      "p_win": 0.030225,
      "p_podium": 0.1043,
      "p_top10": 0.55485,
      "p_dnf": 0.062224,
      "expected_position": 9.5899,
      "position_distribution": [
        0.030225,
        0.03535,
        0.038725,
        0.04355,
        0.04895,
        0.05835,
        0.06345,
        0.07265,
        0.076775,
        0.086825,
        0.087925,
        0.083475,
        0.074975,
        0.065225,
        0.051775,
        0.0375,
        0.02275,
        0.012925,
        0.0061,
        0.002,
        0.00045,
        0.00005
      ],
      "top_factors": [
        {
          "label": "Qualifying position",
          "direction": "positive",
          "magnitude": 0.581229
        },
        {
          "label": "Gap to pole",
          "direction": "negative",
          "magnitude": 0.307013
        },
        {
          "label": "Long-run practice pace",
          "direction": "positive",
          "magnitude": 0.828676
        }
      ]
    },
    {
      "driverId": 842,
      "team_entity_id": "214-2021",
      "p_win": 0.0201,
      "p_podium": 0.07005,
      "p_top10": 0.4159,
      "p_dnf": 0.06289,
      "expected_position": 11.085525,
      "position_distribution": [
        0.0201,
        0.023675,
        0.026275,
        0.030525,
        0.0353,
        0.041775,
        0.0476,
        0.054875,
        0.062575,
        0.0732,
        0.081625,
        0.083175,
        0.085625,
        0.086325,